PK,Description,Statesmanship,control,pivotLeft,pivotRight
4000,"I am the Minister-President of North Rhine-Westphalia, the most populous state in Germany. The CDU is the party of competence - and none of my opponents has held a political office in the last few years. I will bring my expertise in modern governance to the national level.",2,0,,
4001,"Out of the three candidates nominated, I am the only one who has actually won an election and in a former SPD-stronghold nonetheless, in a strong black-yellow coalition. It is crucial that we win the Bundestagswahl this fall, and I am the right man to do it!",,0,,
4002,"I am more conservative than Röttgen and more liberal than Merz. By positioning myself between those two, I can split them apart and draw votes from whoever is knocked out on the first ballot - I’ll then win the second ballot by default.",,0,,
4003,The party officials are largely behind me. They should push for me behind closed doors to make sure I win this contest. I will already focus on convincing swing voters for the election.,,0,,
4004,"I want to continue the legacy of the Merkel-era as much as possible. Her sixteen years of chancellorship were outstanding, and I promise to continue on that course.",1,0,,
4005,"The CDU is the party for the middle of society. I will continue moving the party into the future, with a moderate and pragmatic course on the issues of the day.",,0,,
4006,"The strong showing of Merz has shown that the right wing of the party has too often been ignored by Merkel. Under my leadership, we will bring the party back on a more conservative path.",-1,0,,
4007,"While I will praise Merkel for her outstanding career, we need to acknowledge the challenges of the 21st century: particularly climate change. It is important that we don’t leave this topic to other parties, but present solutions of our own, that go beyond what we are doing now.",,0,,
4008,"While the lockdowns were the right thing to do, now that the winter is over and we have started to vaccinate people, it is time to return to normalcy. North Rhine-Westphalia will open up quickly.",-2,0,,
4009,"The situation is still very volatile and it is better to be cautious than reckless. We should keep the lockdowns for the foreseeable future, and only open up on strict criteria.",1,0,,
4010,"While I’m all for opening up, we should keep an eye on the number of infected people and have a <span class='mytooltip'>bridge lockdown<span class='mytooltiptext'>Proposal by Armin Laschet. The goal is to generally open up, but to have a short term, harsh lockdown in April, to bridge the time until more people are vaccinated and more tests are available.</span></span> during Easter if the case numbers become too high.",-1,0,,
4011,This is a decision that the federal government and the states have to make together. I will wait and see what this process achieves and go with the majority opinion.,,0,,
4012,"Under no circumstances will we raise taxes, but we don’t want to dramatically lower them. We will phase out the extra tax of the <span class='mytooltip'>Soli<span class='mytooltiptext'>Solidaritätszuschlag. An extra tax levelled since 1995 to help East Germany in its post-reunification development.</span></span> and try to reduce the burden on small and medium-income earners while always keeping the budget balanced, in keeping with the “<span class='mytooltip'>Black Zero<span class='mytooltiptext'>“Schwarze Null” in German; economic principle that forbids new debts while promising a balanced budget.</span></span>”.",1,0,,
4013,"The Covid crisis has left a massive hole in our budget that we have to plug somehow. We have to be measured, but a tax increase will likely be unavoidable to avoid harsh debts that can hurt our economy even further.",-1,0,,
4014,"Taxes for private households should stay where they are or even be lowered by phasing out the <span class='mytooltip'>Soli<span class='mytooltiptext'>Solidaritätszuschlag. An extra tax levelled since 1995 to help East Germany in its post-reunification development.</span></span>. More importantly, corporate taxes should be lowered to unleash the full economic potential of this country. As little State as necessary, as much market as possible.",,0,,
4015,"To stimulate the economy after the Covid crisis, taxes have to be lowered across the board for both private households and corporations. We also have to streamline tax bureaucracy, and consider new solutions, in the form of flat tax proposals for example.",-2,0,,
4016,I was as shocked as everyone else when I found out about this! The parliamentary immunity of these MPs should promptly be removed so they can be properly investigated. Corruption has no place in the CDU/CSU!,-2,0,,
4017,Let’s wait and see how this develops. I’ll issue a brief statement that we want to wait until it’s clear what actually happened.,-2,0,,
4018,This is nothing but a political hit job by a left-wing magazine in an election year. I’m sure further investigations will prove the innocence of these MPs.,-4,0,,
4019,"Let us be pragmatic. Two of our MPs may have indeed shown low moral inhibitions, but we shouldn’t judge the whole party based on the actions of two people. We support this investigation as much as anyone else, these are individual black sheep.",-3,0,,
4020,"This seems like a good time to declare my candidacy, yes. Though before I declare, I will make a courtesy call to Markus Söder, the party leader of our sister party, the CSU, to make sure he won’t oppose me.",1,0,,
4021,"Yes, I will inform the upper party echelons and formally announce this during a press conference in my home state. There is no time to lose! It’s time for the campaign to get going.",,0,,
4022,"You know, it might be better to wait this out a bit longer - just biding our time and consolidating our party influence. I can declare after whatever announcement the Green party makes to get them out of the limelight.",-1,0,,
4023,"It wasn’t an easy decision. I thought about this long and hard, but I want to retract my candidacy. Söder is a competent man, has better polling numbers, many of our party members support him and I’m quite happy here serving as Minister-President of North Rhine-Westphalia.",,0,,
4024,"Let’s call every big name in the party, curry every favour, maybe we can even get Merkel herself to weigh in. I can’t have this decided by vote and risk being humiliated, I want this decided by the party elites now.",-1,0,,
4025,The party parliamentary group of CDU and CSU shall vote on this. I’m confident they will pick me over Söder - his support primarily comes from Bavaria and I have the traditional prerogative as leader of the bigger party.,,0,,
4026,The party parliamentary group of CDU and CSU shall vote on this. I’m confident they will pick me over Söder - his support primarily comes from Bavaria and I have the traditional prerogative as leader of the bigger party.,,0,,
4027,"First and foremost, I want to thank Markus Söder for accepting this outcome. We have to be united as a party to win this fall. Apart from that, I will hit my usual talking points, about stability, pragmatism, praising Merkel and acting on our values.",1,0,,
4028,"This closer-than-expected contest has convinced me that I need to move my position and change my attitude on some topics. I’ll focus on how dealing with the pandemic and not opening up too quickly is of critical importance, how we need strong leadership in these trying times and new ideas to move forward, to build on Angela Merkel's successes.",,0,,
4029,"I will give a largely non-political speech. We need to focus on the importance of cohesion and trust in our society, to come together as one in the wake of this crisis, not letting our different views divide us, and the values of honest work. I want to bring up the anecdote about my father, who was a miner. A statesman is what we need right now.",3,0,,
4030,"The success of the AfD showed us that this country is in dire need of change and a new direction, away from the Status Quo. I will promise to modernize Germany while letting our conservative values guide us in this progress. A new Germany, responsible and sensible.",,0,,
4031,"The Green party is always surging a few months before elections and comes crashing down in time, just like in 2011 after <span class='mytooltip'>Fukushima<span class='mytooltiptext'>In 2011, a disaster took place at the nuclear reactor in Fukushima, Japan. Resulted in the first Green surge, and Merkel changing course on Nuclear Energy; resuming the phase-out that started under the preceding Red-Green coalition.</span></span>. I’m not too worried - we should still focus more on competing with the SPD, our traditional opponent.",-1,0,,
4032,"I will take this development very seriously, clearly the demand is there to take the climate more seriously. Let’s unveil some of our own environmental policies to stop their momentum and defuse some of their criticisms.",,0,1,
4033,"Off the record, it’s not the worst thing that these two parties compete for centre-left votes. This makes the path to first place a lot easier. Let’s focus somewhat on the Greens as our main contender in that regard, and just attack them moderately where we can.",,0,,
4034,"Actually, this is a bit ridiculous and reminds me of the publicity stunt the FDP pulled in 2002 when they nominated <span class='mytooltip'>Guido Westerwelle<span class='mytooltiptext'>FDP party chair (2001-2011) and later Foreign Minister (2009-2013). Was named as  “chancellor candidate” by the FDP in 2002, in a bid to win 18%, but only got 7.4. One of the first German politicians to come out as gay, he sadly died in 2016 from leukemia.</span></span> as chancellor candidate. Let’s mock them for their hubris and don’t refer to Baerbock as a legitimate chancellor candidate.",-3,0,,
4035,"It is important that we don’t demonize Putin and keep our dialogue open. I’m critical of many things the Russian leadership has done, but overall, we should strive to cooperate with them, as we do on the <span class='mytooltip'>Nord-Stream 2<span class='mytooltiptext'>Planned natural gas pipeline from Russia to Germany, through the Baltic Sea.</span></span> pipeline.",1,0,,
4036,"I’ve been more lenient in the past, but enough is enough. I will join in with the criticism against <span class='mytooltip'>Kretschmer<span class='mytooltiptext'>Michael Kretschmer, Minister-President of Saxony (Since 2017). Traveled to Moscow, and at several points demanded the sanctions against Russia be lifted. Was also somewhat of a soft Covid-skeptic in 2020, but changed course later on.</span></span> and call for a tougher stance towards Putin. Maybe we should only open the <span class='mytooltip'>Nord-Stream 2<span class='mytooltiptext'>Planned natural gas pipeline from Russia to Germany, through the Baltic Sea.</span></span> pipeline if we get some concessions from Russia.",,0,,
4037,"<span class='mytooltip'>Kretschmer<span class='mytooltiptext'>Michael Kretschmer, Minister-President of Saxony (Since 2017). Traveled to Moscow, and at several points demanded the sanctions against Russia be lifted. Was also somewhat of a soft Covid-skeptic in 2020, but changed course later on.</span></span> is completely right, we have to talk more with Russia, not less. I’m all in favor of more dialogue and stronger economic ties with Russia. Besides, it’s not like the USA has never done anything wrong.",,0,,
4038,"This whole thing is overblown, this trip was mostly for cultural exchange. I don’t have much to say about this. We stand on our commitment to Nato.",-1,0,,
4501,"I supported Merkel's decision at the time, we needed to take those people in to prevent a humanitarian catastrophe at the Austrian-Hungarian border. Today though, we need to be more mindful of European border security. To that end, we want to strengthen the <span class='mytooltip'>EU<span class='mytooltiptext'>European Union; supranational political entity, serving as a political and economic union between 27 European countries, including free trade, open borders, political cooperation and a common legislative body. Germany is a prominent member, being one of its predecessors founding members, going back to the post-war era.</span></span> border enforcement agency <span class='mytooltip'>Frontex<span class='mytooltiptext'>The European Agency for Border- and coastal protection of the Schengen Area (internally, the EU does not have border patrols).</span></span>.",1,0,,
4502,"There’s no way around it - Germany is an immigration country. We need a comprehensive overhaul of our immigration laws - we don’t have a good system in place to attract qualified immigrants, who could be advantageous to our economy and demographic situation.",,0,,
4503,"Merkel was absolutely right to take in these people. We’re saying: Refugees Welcome! As a western country partially responsible for colonialism, we have a responsibility for humanitarian aid, including initiatives to rescue capsized refugee boats in the mediterranean.",,0,,
4504,"On this issue, Merkel has erred - her rhetoric was dangerous in provoking even more refugees and immigrants to come here. We simply can’t take everyone. We need more border security in the <span class='mytooltip'>EU<span class='mytooltiptext'>European Union; supranational political entity, serving as a political and economic union between 27 European countries, including free trade, open borders, political cooperation and a common legislative body. Germany is a prominent member, being one of its predecessors founding members, going back to the post-war era.</span></span> and faster deportation processes to avoid another disaster - <span class='mytooltip'>2015<span class='mytooltiptext'>In 2015, about 2 million people sought refuge in Europe, coming from the Mediterranean Sea and the Balkans. A great amount had been held up in Hungary, until Merkel unilaterally decided to let them come to Germany. About 400k Syrians fled to Germany during this time.</span></span> can’t repeat itself.",,0,,
4039,"This was a bad decision by the court. The <span class='mytooltip'>Climate Protection Act<span class='mytooltiptext'>“Klimaschutzgesetz” in German. Originally enacted by the Grand Coalition in 2019, it promises to uphold the goals by the Paris Conference and lays down concrete goals for CO²-emissions until 2030.</span></span> already went far enough and I’m not in favor of hurting the economy with a stricter climate policy. We need to look out for our workers and industry, fear is not the answer.",-2,0,,
4040,"It is important that we quickly implement the new law. I’m especially in favour of a price for CO<sub>2</sub> that is formed by market forces. We have to make sure that everyone can keep affording their energy bills, though, and we need to use this opportunity to create new jobs.",1,0,,
4041,"We have to become carbon neutral long before 2050. I’m sure the government under Merkel will come up with a sensible solution, which I will continue as chancellor.",1,0,,
4042,"With the decision by the court, we now have a great opportunity for an ambitious new <span class='mytooltip'>Climate Protection Act<span class='mytooltiptext'>“Klimaschutzgesetz” in German. Originally enacted by the Grand Coalition in 2019, it promises to uphold the goals by the Paris Conference and lays down concrete goals for CO²-emissions until 2030.</span></span>. I advocate for Germany to be carbon neutral by 2040 and to accelerate the transition to renewable energies. We simply can’t wait anymore.",,0,,
4505,"Yes, I do. Angela Merkel is a highly esteemed stateswoman and one of the best chancellors this country ever had - although to modernize our party, we have to recalibrate our course on climate change and protecting our social safety net. The CDU is an innovative party of the 21st century, and I will not let myself get intimidated by right-wing demagogues.",2,0,10,
4506,"I do not think in ideological categories, I’m simply standing for what I think is good for Germany. The CDU is the party of good governance - not radicalism, both leftist or rightist.",1,0,10,
4507,"I wanted to begin this campaign by bringing us all together - now we can try to tilt the discourse rightwards, taking Merkel supporters with us while framing our conservative positions as more reasonable.",,0,,
4043,"We need to open up quickly for vaccinated people. A return to normalcy has never been so close, and we all had more than enough of lockdowns - not every measure might still be proportionate. Vaccinated people have less risk and thus should receive more benefits.",,0,,
4044,"We are currently in a very critical phase of the pandemic, a phase in which cohesion could easily be endangered. Vaccinated people should be exempt from some restrictions, but let’s not go overboard. We need to move forward together and be patient until science tells us that it’s safe.",1,0,,
4045,"It’s important that as many people as possible get vaccinated as quickly as possible so we can overcome this crisis, but that’s not what’s happening. Maybe we should question the prioritization system we have right now.",,0,,
4046,"The vaccine seems helpful now, but we haven’t had a chance to study its side effects yet. We should be mindful of our bodily health and not be too quick in our judgment - I advocate for a slowdown of the vaccination campaign until we have more information.",-2,0,,
4047,"For years and years, we have consistently missed the <span class='mytooltip'>NATO<span class='mytooltiptext'>North Atlantic Treaty Organization; international defensive military alliance between the United States, Canada and multiple European countries, including Germany since 1955. Was the winning party of the Cold War between 1949-1993.</span></span> aim to spend 2% of our gross domestic product on defense. I strongly reaffirm our commitment to <span class='mytooltip'>NATO<span class='mytooltiptext'>North Atlantic Treaty Organization; international defensive military alliance between the United States, Canada and multiple European countries, including Germany since 1955. Was the winning party of the Cold War between 1949-1993.</span></span> and this goal! The West has to be united against potential threats.",1,0,,
4048,"While I strongly reaffirm our support of a united Alliance and strong defense, I specifically want to call out Annalena Baerbock. She lacks a clear commitment to <span class='mytooltip'>NATO<span class='mytooltiptext'>North Atlantic Treaty Organization; international defensive military alliance between the United States, Canada and multiple European countries, including Germany since 1955. Was the winning party of the Cold War between 1949-1993.</span></span>, which is not appropriate for a chancellor.",,0,,
4049,"I want to praise the work we’ve done so far and believe we are in a good spot. While I strongly reaffirm my commitment to <span class='mytooltip'>NATO<span class='mytooltiptext'>North Atlantic Treaty Organization; international defensive military alliance between the United States, Canada and multiple European countries, including Germany since 1955. Was the winning party of the Cold War between 1949-1993.</span></span>, we don’t need to spend more on defense than we do right now; we need to combat waste first and foremost.",,0,,
4050,"<span class='mytooltip'>NATO<span class='mytooltiptext'>North Atlantic Treaty Organization; international defensive military alliance between the United States, Canada and multiple European countries, including Germany since 1955. Was the winning party of the Cold War between 1949-1993.</span></span> is a relic of the cold war. We should stay a member for now, but we should also try to find avenues for cooperating with other nations, keep reaffirming our neutrality, and open up new dialogues with Russia or China.",-2,0,,
4508,"The heart of this problem lies in Germany's low birth rates. We need to further encourage the founding of families, with benefits for married and childbearing couples. Family-friendly policies will strengthen our social cohesion and collective values and invest in our future.",,0,,1
4509,"A sustainable answer to keep our social support net afloat lies in immigration. We are an attractive place in Europe for many seeking a safe and economically secure future, and we should finally implement a real immigration law, for example with a <span class='mytooltip'>Canada-style point-system<span class='mytooltiptext'>In Canada, points are awarded for potential “economic immigrants”, for qualifications, education and experiences, formally indiscriminate of the origin country. Said to be quite successful in attracting qualified workers.</span></span>.",,0,,
4510,"It's clear that the current system is unsafe. We should build on our public pension system, reform the <span class='mytooltip'>Riester-system<span class='mytooltiptext'>State-encouraged private pension system named after former Minister of Labour, Walter Riester (SPD, 1998-2002), aimed at low-income workers who may get tax refunds on privately saved up money.</span></span>, and refrain from raising the pension age any further than 67! We also need to introduce a higher state-provided minimum pension to fight old-age poverty.",,0,1,
4511,"We need to overhaul the bureaucratic costs of the system and listen to the decisions of the advisory councils. The mix of public, occupational and private pension systems contributes to safe pension levels, particularly occupational and private provisions should be strengthened. We can also look at Swedish-style stock-based pension funds.",,0,,
4051,"I want to congratulate <span class='mytooltip'>Haseloff<span class='mytooltiptext'>Reiner Haseloff, Minister-President of Sachsen-Anhalt (CDU, since 2011). Grew up in East Germany, and joined the CDU- block party in the DDR early on. Generally uncontroversial and respected.</span></span> for his strong performance. It shows that the citizens still trust the CDU to be the best governing party, and we want to emulate his strategy on a national scale.",2,0,,
4052,"<span class='mytooltip'>Haseloff<span class='mytooltiptext'>Reiner Haseloff, Minister-President of Sachsen-Anhalt (CDU, since 2011). Grew up in East Germany, and joined the CDU- block party in the DDR early on. Generally uncontroversial and respected.</span></span> performed very well, but I want to emphasize that the AfD lost votes. When we keep appealing and listening to all people, without prejudice, we can win them back for the democratic parties.",,0,,
4053,"This was a very strong performance. To show my gratitude, I will make an extra trip to Saxony-Anhalt and campaign with him for some nice pictures.",1,0,,
4512,We should definitely hit her on these topics. This is unprofessional behavior that should not happen in the chancellery. These concerns about her integrity have to be addressed.,,0,,
4513,"Not only that - did you notice how she used the N-Word in that interview, and had to be censored out? Such mistakes of communication are unacceptable for a chancellor, and the problematic nature of this faux pas should sheds doubt on her character.",-1,0,,
4514,"People can make their own decisions about this, what I want to talk about is substance. Her policies are expensive for the middle class and ineffective, and she knows it. She talks - I act.",1,0,,
4515,"People aren’t clamoring for my comments here, they will be judged on their own. I want to stay positive and talk about the successes I will bring to Germany.",2,0,,
4054,"The pandemic has shown how ill-prepared our schools are. We need to continue improving digital infrastructure in education, through more training, technical assets and a national educational platform. That is what the CDU/CSU has worked on, and will continue doing.",,0,,
4055,"Actually, we don’t have much to gain by talking about this topic - many voters see us as responsible for the current situation. Let’s downplay it as much as we can and focus on issues where we are seen as more competent, like matters of security or debt.",-1,0,,
4056,"We definitely need to modernize the digital infrastructure of Germany, especially in the public sector. Administrative matters have to be more accessible to citizens, we need to digitize all internal processes and cut down on bureaucracy.",,0,,
4057,"Digitalization is a key issue - we need a digital transformation offensive. I want to especially emphasize that we will accomplish a nationwide 5G mobile network by 2025 and provide 15 billion Euros for Gigabit-networks. To that end, we will also establish a Ministry of Digital Innovation and Transformation.",1,0,,
4516,"We need to alleviate the housing market by building more. We need to build more than 100.000 housing units, using tax benefits. We should also provide funding to revitalize our cities and villages, advertise rural spaces and reduce the real estate transfer tax - every family should be able to own a home.",,0,,
4517,"We need to emphasize the creation of more social housing, built by modern standards available for those who need it most. For families, we can make buying empty buildings in the countryside easier for young people, as we do in <span class='mytooltip'>NRW<span class='mytooltiptext'>North Rhine-Westphalia</span></span>. Furthermore, we need to fight land speculation and close tax loopholes.",,0,1,
4518,"The situation is tense. It’s clear that action is needed in the form of rent controls. A sharper, unlimited federal rent control program should be introduced. In places where the situation is very problematic, we stand for a so-called ‘rent moratorium’, where rent would only be able to increase with the inflation rate.",-1,0,1,
