PK,Description,Statesmanship,control,pivotLeft,pivotRight
4519,"We are vehemently against programs like rent controls. Social housing projects have failed to improve the situation - instead we need to support low income renters through housing subsidies. Regulations have to be cut back, we need slimmer bureaucracies and faster approval processes so that the market can sort itself out.",,0,,1
4058,"The most important thing we can do right now is help the affected regions with their crisis management. They need help now, quickly and unbureaucratically. I’m promising swift support.",2,0,,
4059,I want to especially praise local teams and local reactions. Some areas already had crisis teams ready when the sun was still shining and no one knew what would happen. We will follow up and provide a better crisis responses in the future.,1,0,,
4060,"First, we need to quickly and diligently help the affected regions with the cleanup operations. After that, we have to guarantee financial emergency aid for affected people, unequivocally.",-1,0,,
4061,"I want to honor the victims, but also address the cause of all this: climate change. Extreme weather events are unfortunately going to become more common -  we need to act decisively and swiftly now to keep global warming below 1.5°C so that we can prevent these disasters.",,0,,
4062,"Actually, I don’t want to be seen as performative. The cleanup operations can be left to professionals, I will keep coordinating the crisis efforts from the state chancellery so that everything goes smoothly - that’s the best I can do for the victims.",-3,0,,
4063,"I want to get out there, yes. I have to look at the carnage myself, at least for a day or two. <span class='mytooltip'>NRW<span class='mytooltiptext'>North Rhine-Westphalia</span></span> is among the most affected states after all. Let’s try to keep my visits below the radar though, so we don’t generate too much media buzz - that could be seen as opportunistic. Maybe some interviews with local newspapers and radio stations.",-1,0,,
4064,"What a great idea! We should get out there and visit some affected towns - our President <span class='mytooltip'>Frank-Walter <span class='mytooltip'>Steinmeier<span class='mytooltiptext'>Frank-Walter Steinmeier: holder of the highest office of the land - The Federal President of Germany. Nominally a member of the SPD, he was Foreign Minister 2005-2009 and 2013-2017, when he was voted in as head of state. Generally respected, except by the political extremes.</span></span></span> will be here in a few days, so let’s try to get some shared pictures with our head of state. Catch some of his gravitas.",-4,0,,
4065,"What a great idea! We should get out there and visit some affected towns - our President <span class='mytooltip'>Frank-Walter <span class='mytooltip'>Steinmeier<span class='mytooltiptext'>Frank-Walter Steinmeier: holder of the highest office of the land - The Federal President of Germany. Nominally a member of the SPD, he was Foreign Minister 2005-2009 and 2013-2017, when he was voted in as head of state. Generally respected, except by the political extremes.</span></span></span> will be here in a few days, so let’s try to get some shared pictures with our head of state. Catch some of his gravitas.",2,0,,
4066,The floods have shown that we need to be much more ambitious than before. One of the worst offenders is our energy production: we need to stop using coal for energy generation by 2030 and seek out new innovative technologies to keep energy affordable.,,0,1,
4067,"Climate change is coming, whether we want it or not. The most important thing we can do is mitigate its worst effects to prevent catastrophes like this from doing too much damage - we need better crisis responses. Climate action is necessary, as long as it doesn't stifle our economy and freedom of living.",,0,,1
4068,"Germany is no stranger to floods. I’m sorry, but just because today is a day like this, you don't just change your politics. The question of climate change is an international one, we can’t trivialize it like this.",-3,0,,1
4069,"We clearly need to pick up the pace on climate action. But if you look back, it’s the environmentalist movement who concentrated on the wrong issue; for 20 years they’ve fought to end nuclear energy, instead of coal. Germany now exits nuclear as pretty much the only country, our focus is misguided.",-1,0,,
4070,"Compulsion is the wrong way to go about this, and probably unconstitutional. Instead, we need to convince people of the dangers of not being vaccinated and to continue our information campaign as we are now.",1,0,,
4071,"While I wouldn’t go that far, as we might run into legal issues, we should give people more incentives to get vaccinated. One solution might be to open up certain establishments from the lockdown, but only for vaccinated and recovered people.",,0,,
4072,"Covid is basically over, the case numbers are very low. One has to be honest and ask: Do we even need such an expensive program? Vaccines are good to have, but we should focus on opening up and treating Covid as the non-problem it has become.",-4,0,,
4073,"This might be a good idea. The country needs to move on, we need to do everything we can to finally make Covid history. At some point, we need to have the conversation about mandatory vaccines, and fine those that refuse to get one.",-1,0,,
4074,"We have to modernize my image. Let’s incorporate some biographical elements, like that my father was a miner, and show pictures of how I closed the last mine in North Rhine-Westphalia. Then talk about tackling climate change together and how we need to promote tolerance.",-2,0,,
4075,"Covid is still on the mind of most people. Let’s focus on my response to this crisis, show me in a lab coat or something. With a strong vaccination campaign, we will continue Merkel's course and bring normalcy back!",-1,0,,
4076,It’s best to play it safe. My motto is “Making Germany Together” - I want a spot about how I’m bringing different people together and how our country needs solidarity in this crisis. Let’s show the diversity in our supporters and promise that we will bounce back stronger than before.,,0,,
4077,"I’ve been governing North Rhine-Westphalia successfully since 2017. I want to talk about my home, show my successes here and promise to bring them to Germany, as a <i><span class='mytooltip'>Landesvater<span class='mytooltiptext'>“State-Father”. Traditionally a feudal lord, today jokingly used for a Head of Government in a state, usually an older male, serving as a trustworthy icon of a statesman.</span></span></i>. Give off an air of trustworthiness - let’s even invoke my Green colleagues’ Winfried Kretschmanns “You know me.”-quip.",1,0,,
4520,"Cannabis is a societal reality, like alcohol. We should start to take steps towards a regulated distribution to adults, accompanied by addiction prevention measures. The possession of small amounts shouldn’t be prosecuted anymore.",,0,1,
4521,"We are against the legalization of illegal drugs. The risks for the individual and society are too great - instead, we should work towards addiction prevention, as well as early and suitable sanctions, that incentivise taking counseling and therapy. We do acknowledge the medical usage of Cannabis, however.",,0,,1
4522,"Legalize it! We are for permitting the controlled distribution of Cannabis, through regulated sales in licenced shops. We do need projects to prevent drug abuse and youth protection though, financed through consumption taxes, as well as a legal framework around marihuana usage.",-1,0,1,
4523,"Not at all: we need to further pursue drug users and lower the amount of cannabis that is legally prosecuted. Our goal is a drug free society. Look at the Netherlands, they have decriminalized the possession of just 5 grams, with fatal consequences - that won’t happen to our children.",-1,0,,
4078,"We will talk with all democratic parties - the SPD, the Greens and the FDP. However, I want to needle the leftist parties for not ruling out a coalition with the extremist Left. They are fringe populists, unfit to govern.",,0,,
4079,"We rule out coalitions with the extremes. Normally we would talk with everyone in the center, but it’s clear how a continuation of the Grand Coalition of the last 8 years would not have a public mandate. We need to find a different governing majority.",,0,,
4080,The last few years have shown how we can not ignore the 10-15% of the populace voting for the AfD. This country needs change and new solutions. I think a Bahamas coalition with the AfD and the FDP could work - Austria showed us how the right wing can govern harmonically.,,0,,
4081,"My favorite coalition would be Black-Yellow, like the one I’m leading in North Rhine-Westphalia now. The FDP is a reliable partner, and we could get some really good policies done together.",,0,,
4524,"While §218 is a settled compromise from our societal discussions, we are for striking the §219a ad ban: women who are deciding on an abortion need unrestricted access to information. We also need to train more doctors and prevent pressure from abortion opponents in front of clinics.",,0,1,
4525,"We want to strike $218, 219 and 219a from the books completely. Pregnancy issues are not part of criminal law - abortion is a medical service that has to be managed as part of regular health care. The stigma has to be broken, and the supply of doctors offering abortion has to be increased.",,0,1,
4526,"The current situation is fine as is. Unborn life does have a right to be protected. Furthermore, the ad ban has already been loosened two years ago, to provide better access to information for affected women and legal certainty for doctors and hospitals, if an abortion is necessary.",,0,,1
4527,"The right to life does not stand to disposition. The unborn child has a right to live, and we stand vehemently against efforts to trivialize or encourage abortions from the state. Instead, adoption procedures should be simplified - while doctors who do not report abortions have to incur noticeable sanctions.",,0,,1
4082,"This is the biggest debacle for <span class='mytooltip'>NATO<span class='mytooltiptext'>North Atlantic Treaty Organization; international defensive military alliance between the United States, Canada and multiple European countries, including Germany since 1955. Was the winning party of the Cold War between 1949-1993.</span></span> since its founding, but also a miscalculation on the part of the government. We need a relentless analysis of what went wrong. I also need to criticize the USA’s role in this, the mandate for our troops still went until 2022, but we can’t hold it down alone.",,0,,
4083,"It’s a disgrace how so many good people would now have to live under civil strife and a possible <span class='mytooltip'>Taliban<span class='mytooltiptext'>Islamistic terror organization, ruling over Afghanistan. Founded from mujahedeen, during the war against the soviet union. Responsible for the 9/11 attacks, and probably the single most well known terror group.</span></span> takeover. We need to take in more refugees from Afghanistan, especially people who cooperated with the German troops. We owe it to them, after their generous help!",,0,,
4084,"Foreign Minister <span class='mytooltip'>Heiko Maas<span class='mytooltiptext'>SPD chair of the Saarland (2000-2018) and Minister of Justice 2013-2018, where he had the reputation of somewhat of a nerd. He then became Foreign Minister (2018-2021). In the wake of the botched Afghanistan-retreat, he offered his resignation, but was talked out of it by Olaf Scholz.</span></span> of the SPD is clearly to blame for our part in this crisis, and has to take political responsibility. He should have started the evacuations much earlier, and there should be direct repercussions for his position.",,0,,
4085,"Okay, uh… one thing’s clear, we can’t have a repeat of the refugee crisis in <span class='mytooltip'>2015<span class='mytooltiptext'>In 2015, about 2 million people sought refuge in Europe, coming from the Mediterranean Sea and the Balkans. A great amount had been held up in Hungary, until Merkel unilaterally decided to let them come to Germany. About 400k Syrians fled to Germany during this time.</span></span>. Let’s tell them, we are watching the situation closely, but we concur with Interior Minister <span class='mytooltip'>Horst <span class='mytooltip'>Seehofer<span class='mytooltiptext'>Horst Seehofer, infamous CSU politician. After stints as Minister of Health (1992-1998) and Minister of Agriculture (2005-2008) he was the Minister-President of Bavaria (2008-2018). During his tenure, he vehemently opposed Merkel’s decision to welcome refugees in 2015. Afterwards, he became Minister of the Interior, mostly continuing his hardline stance.</span></span></span> that criminal refugees still have to be sent back to Afghanistan, with a zero-tolerance policy.",,0,,
4086,"Olaf Scholz has been surging a lot in the polls recently and privately, I worry that he will not stop. We compete for a lot of voters with his wannabe-Merkel attitude - it seems foolish to do anything but attack him on his many weaknesses.",,0,,
4087,"Baerbock has been struggling lately, but the Greens are still a strong party with a vulnerable candidate, and some voters we could pick up. Let’s focus on her.",,0,,
4088,I will leave petty attacks to my opponents and focus more on policy. I’m certain the German people will appreciate hearing concrete solutions to their problems more than attacks. This isn’t America.,,0,,
4089,"Actually, I don’t want two left-wing politicians to gang up on me. This format is not up to the times and I can guarantee, time will not be allotted fairly to the only centrist party at the table. Thus, I must decline this invitation.",,0,,
4090,"He likes to present himself as a moderate, but he hasn’t completely ruled out a coalition with the extremist Left party. Can voters really trust him not to form a coalition with populist demagogues after the election?",,0,,
4091,"Let’s hit him on his scandals as finance minister. Under his watch, <span class='mytooltip'>Wirecard<span class='mytooltiptext'>Financial company, who ran a bank until 2020, when they shut down due to several billion Euros missing. The regulatory organization under Minister of Finances Olaf Scholz was heavily criticized for its lack of action, despite being informed about the inconsistencies.</span></span> collapsed due to fraudulent dealings and lots of people lost their money. We need to poke attention to the police raid on a government office belonging to his ministry - he refuses to take responsibility.",,0,,
4092,"Scholz likes to pretend he’s a moderate, but the program of his party is very leftwing, especially regarding pensions and the minimum wage. It shows that the SPD as a whole is unfit to govern.",,0,,
4093,"Actually, I’ve changed my mind. The mudslinging isn’t worth it - after giving my usual critiques I’ll just wing it and rely on my instincts as a statesman to rise above the pack.",,0,,
4094,"She’s had problems with plagiarism in her book, and she inflated her CV. These might seem like minor things, but can she really be trusted to govern this country, if she fails at these minor tasks?",,0,,
4095,"Everyone on this stage agrees that something has to be done about climate change, but what Mrs Baerbock and her party want can’t be the solution! We need to involve everyone, protect livelihoods and emphasize innovation, instead of blanket bans, as Mrs. Baerbock advocates.",,0,,
4096,"I’ll attack her for her willingness to govern with the radical Left party. Moderates should be frightened by this prospect, there should be a firewall against Radicals of all stripes, and entertaining a coalition with the Left, as the Greens do repeatedly is irresponsible.",,0,,
4097,"Actually, I’ve changed my mind. The mudslinging isn’t worth it - I’ll just broadly criticize Baerbock for her incompetence and then just wing it, relying on my instincts as a statesman to rise above the pack.",,0,,
4098,I want to present myself as a candidate for pragmatic solutions to climate change. We clearly have to take action: What we need is room for market innovation and international cooperation. I’m proud of the path Germany is on in this regard - we don’t need strict bans.,,0,,
4099,"With two left-leaning politicians debating with me, I will present myself as the voice of reason. We have tax and social security plans that are actually affordable and generally promise sensible governance. The CDU is the party of the healthy centre - of competency and fiscal responsibility.",,0,,
4100,"You know me. I’m a known quantity from North Rhine-Westphalia, where I’ve governed with prudence and caution - just like Chancellor Merkel. I’m the candidate who stands for a continuation of the Merkel era - with me, Germany will stay on its successful path.",,0,,
4101,"Actually, screw this! I know they won’t hold back, so I won’t either. We have enough ammunition to show Baerbocks and Scholz’ incompetence, and I shouldn’t be afraid to use it. That way, I can sharpen my profile and show myself as the most competent candidate.",,0,,
4528,Let's hope Mr. Dobrindt makes a good impression for the Union cause.,,0,,
4529,Let's hope Mr. Dobrindt makes a good impression for the Union cause.,,0,,
4530,Let's hope Mr. Dobrindt makes a good impression for the Union cause.,,0,,
4531,Let's hope Mr. Dobrindt makes a good impression for the Union cause.,,0,,
4102,"It’s important that all wings of our party stay united and motivated to vote. Let’s campaign with Friedrich Merz to show that I’m taking people like him and his positions seriously - the CDU has a clear profile, and I’m proud to stand with him for our values!",,0,,
4103,"Who else but Chancellor Angela Merkel could be the right person? She is a figure larger than life, a great icon who has won the last four elections, and I want to show people that I’m the one to continue her legacy.",,0,,
4104,"No matter what happens, we have to make sure the right-wing demagogues do not increase their vote shares. I’m worried about the AfD taking first place in some East German states, and direct mandates could go to them: I need to campaign broadly in the <span class='mytooltip'>New States<span class='mytooltiptext'>“Neue Bundesländer”. Somewhat archaic name for the East German states that joined West Germany in 1990.</span></span>, with local colleagues like Haselhof and <span class='mytooltip'>Kretschmer<span class='mytooltiptext'>Michael Kretschmer, Minister-President of Saxony (Since 2017). Traveled to Moscow, and at several points demanded the sanctions against Russia be lifted. Was also somewhat of a soft Covid-skeptic in 2020, but changed course later on.</span></span>.",,0,,
4105,"Markus Söder and I didn’t always have the warmest relationship, but there is a reason he gave me such a scare - the man has charisma. Let’s campaign with him in Bavaria and show some unity between the CDU and CSU.",,0,,
4532,"I stand by my moderate credentials, I am a proud Christian Democrat. However, we are competing with two left-wing alternatives- in order to win a strong mandate, we need to pivot leftwards, toward the center.",,0,,
4533,"The CDU is the party of the center. We have done a great job at governing over the last 16 years, and while we need to move into the future, our future is a Christian-Democratic one. I stand by my course.",2,0,,
4534,"Merz has tapped into a surprisingly large voter potential in 2018: Merkel-sceptic conservatives. The chancellor has become popular with voters of the other parties - for us, some of her policies are a bit more controversial. On these issues, we definitely need to move rightwards - to provide for a real alternative to the Greens and SPD.",-1,0,,
4535,"I stand for what I think is right, but it’s become clear to me we need to defuse ourselves. Let’s reconcile with the more leftwards elements of the party - so that they won’t defect to the Liberals, or even our opponents.",1,0,,
4536,"Yes. I stand for what I believe is right in this country, and it’s clear how we need a change in attitude in Germany to stay competitive. Our standing in the world is decreasing, and we need to work towards improving our country to be the best it can be, because we are patriots.",1,0,,10
4537,"Look - chancellor Merkel is a competent woman who I respect. But the fact of the matter is, her policies have tilted leftwards, both socially and economically. What our country needs in the post-Merkel era are policies more in line with conservative doctrines - the AfD’s success has shown that. If anything, we need to come back to our roots and move this country to the right.",-2,0,,10
4538,"While the results in Saxony-Anhalt are definitely praiseworthy, me and my surrogates should focus on Baerbock’s scandals. We’re running a national campaign - and directly dealing with our opponent might be better than lingering on state elections.",,0,,